paper_id,paper_doi,paper_title,paper_abstract,num_references_compared,reference_ids,reference_titles,reference_similarity_scores,average_similarity_score
https://openalex.org/W1973728792,https://doi.org/10.1103/physrevlett.98.223601,Time-Reversal and Super-Resolving Phase Measurements,"We demonstrate phase super-resolution in the absence of entangled states. The key insight is to use the inherent time-reversal symmetry of quantum mechanics: our theory shows that it is possible to measure, as opposed to prepare, entangled states. Our approach is robust, requiring only photons that exhibit classical interference: we experimentally demonstrate high-visibility phase super-resolution with three, four, and six photons using a standard laser and photon counters. Our six-photon experiment demonstrates the best phase super-resolution yet reported with high visibility and resolution.",5,"[""https://openalex.org/W2062584998"", ""https://openalex.org/W3037089521"", ""https://openalex.org/W2076476236"", ""https://openalex.org/W2152231616"", ""https://openalex.org/W2051618454""]","[""Measurement of subpicosecond time intervals between two photons by interference"", ""Quantum Metrology"", ""Experimental realization of any discrete unitary operator"", ""Quantum Interferometric Optical Lithography: Exploiting Entanglement to Beat the Diffraction Limit"", ""Optimal frequency measurements with maximally correlated states""]","[0.5314234742197645, 0.5609186730571696, 0.5635832826825095, 0.5719105980508636, 0.6342195590506092]",0.572411117
https://openalex.org/W2141954753,https://doi.org/10.1088/1367-2630/15/7/073032,EPR-based ghost imaging using a single-photon-sensitive camera,"Correlated photon imaging, popularly known as ghost imaging, is a technique whereby an image is formed from light that has never interacted with the object. In ghost imaging experiments, two correlated light fields are produced. One of these fields illuminates the object, and the other field is measured by a spatially resolving detector. In the quantum regime, these correlated light fields are produced by entangled photons created by spontaneous parametric down-conversion. To date, all correlated photon ghost imaging experiments have scanned a single-pixel detector through the field of view to obtain spatial information. However, scanning leads to poor sampling efficiency, which scales inversely with the number of pixels, N, in the image. In this work, we overcome this limitation by using a time-gated camera to record the single-photon events across the full scene. We obtain high-contrast images, 90%, in either the image plane or the far field of the photon pair source, taking advantage of the Einstein–Podolsky–Rosen-like correlations in position and momentum of the photon pairs. Our images contain a large number of modes, &gt;500, creating opportunities in low-light-level imaging and in quantum information processing.",5,"[""https://openalex.org/W2090475034"", ""https://openalex.org/W2072456425"", ""https://openalex.org/W2038740356"", ""https://openalex.org/W2019335204"", ""https://openalex.org/W2044651951""]","[""Optical imaging by means of two-photon quantum entanglement"", ""\u201cTwo-Photon\u201d Coincidence Imaging with a Classical Source"", ""Ghost Imaging with Thermal Light: Comparing Entanglement and ClassicalCorrelation"", ""Demonstration of the Einstein-Podolsky-Rosen paradox using nondegenerate parametric amplification"", ""High-Resolution Ghost Image and Ghost Diffraction Experiments with Thermal Light""]","[0.6611569564447252, 0.7145442292601208, 0.6877435073429589, 0.5380797596563857, 0.7026551412711708]",0.660835919
https://openalex.org/W2120076475,https://doi.org/10.1103/physrevlett.113.090402,Compressive Direct Measurement of the Quantum Wave Function,"The direct measurement of a complex wave function has been recently realized by using weak values. In this Letter, we introduce a method that exploits sparsity for the compressive measurement of the transverse spatial wave function of photons. The procedure involves weak measurements of random projection operators in the spatial domain followed by postselection in the momentum basis. Using this method, we experimentally measure a 192-dimensional state with a fidelity of 90% using only 25 percent of the total required measurements. Furthermore, we demonstrate the measurement of a 19,200-dimensional state, a task that would require an unfeasibly large acquiring time with the standard direct measurement technique.",5,"[""https://openalex.org/W2007593159"", ""https://openalex.org/W2122548617"", ""https://openalex.org/W1968356682"", ""https://openalex.org/W2764035156"", ""https://openalex.org/W2109357213""]","[""Phase retrieval algorithms: a comparison"", ""Single-pixel imaging via compressive sampling"", ""How the result of a measurement of a component of the spin of a spin-<i>1/2</i>particle can turn out to be 100"", ""Measurement of qubits"", ""Sparsity and incoherence in compressive sampling""]","[0.39276517224569557, 0.5148228745446419, 0.6559246212674391, 0.6494177566912149, 0.49964963649917293]",0.542516012
https://openalex.org/W1968283349,https://doi.org/10.1364/oe.17.019067,Demonstration of a 3 mW threshold Er-doped random fiber laser based on a unique fiber Bragg grating,"We demonstrate a novel random laser based on a single fiber Bragg grating. A long fiber Bragg grating fabrication technique allows the insertion of a large number of randomly distributed phase errors in the structure of the grating which induces light localization. By writing such a grating in a polarisation maintaining Er-doped fiber, a random laser is demonstrated by pumping the fiber with 976 and 1480 nm pump lasers. The number of emitted modes is observed to be a function of the length of the grating and of the pump power and single-mode operation is shown to be possible. The random fiber laser shows low-threshold (approximately 3 mW) and measured approximately 0.5 pm emission linewidth at a wavelength of around 1534 nm.",5,"[""https://openalex.org/W2264002775"", ""https://openalex.org/W2051439100"", ""https://openalex.org/W1998366730"", ""https://openalex.org/W1994133823"", ""https://openalex.org/W2090112728""]","[""Absence of Diffusion in Certain Random Lattices"", ""Random Laser Action in Semiconductor Powder"", ""Lasing in random media"", ""Random lasing in human tissues"", ""Review on latest developments in random lasers with coherent feedback""]","[0.4264559067137533, 0.6983759082306725, 0.7401619607897371, 0.6451644070809532, 0.6858996103267542]",0.639211559
https://openalex.org/W2053240413,https://doi.org/10.1364/oe.21.027155,Frequency stabilized coherent Brillouin random fiber laser: theory and experiments,"A coherent random fiber laser based on stimulated Brillouin scattering as gain and Rayleigh scattering as distributed feedback mirror was constructed. Its frequency is stabilized by a high finesse narrow-band Fabry-Perot interferometer (FPI) to select lasing frequency within the gain bandwidth. The light confinement within single-mode fiber enhances largely the random lasing directionality, which enables a high-quality coherent random lasing in the weak scattering region by using a milliwatt continuous-wave pump source. The FPI in the laser configuration acts as a frequency selection on the Rayleigh feedback light, and thus the random lasing frequency was locked at one of its transmission peaks giving a relative frequency fluctuation of ~2.5 × 10(-11) at 100 s. The measured frequency jitter is within ~~ ± 20 kHz over 3 hours, 3 dB linewidth is ~50 Hz and frequency noise is ~20 mHz/Hz(1/2) at 10 kHz.",5,"[""https://openalex.org/W2051439100"", ""https://openalex.org/W2100846830"", ""https://openalex.org/W1998366730"", ""https://openalex.org/W1994133823"", ""https://openalex.org/W2071279013""]","[""Random Laser Action in Semiconductor Powder"", ""Time and Frequency (Time-Domain) Characterization, Estimation, and Prediction of Precision Clocks and Oscillators"", ""Lasing in random media"", ""Random lasing in human tissues"", ""Noise initiation of stimulated Brillouin scattering""]","[0.6484855554984048, 0.3638949970836896, 0.7339907449214805, 0.6217630083053307, 0.524375157123424]",0.578501893
